{
    "candidate_id":  "cand-faq-class-calculus-1-2026-spring-a-homework-deadline-20260408T112500Z",
    "kind":  "faq",
    "status":  "open",
    "title":  "Homework 01 submission deadline",
    "summary":  "Students repeatedly ask when Homework 01 is due and where it must be submitted.",
    "class_id":  "class-calculus-1-2026-spring-a",
    "course_id":  "course-calculus-1",
    "actor_role":  "system",
    "confidence":  0.91,
    "tags":  [
                 "homework",
                 "deadline",
                 "faq"
             ],
    "source_refs":  [
                        {
                            "source_id":  "src-announcement-acad-class-calculus-1-2026-spring-a-homework-01-4774b218-20260408T104500Z",
                            "source_type":  "announcement",
                            "chunk_id":  "deadline"
                        }
                    ],
    "session_refs":  [
                         "ses-student-stu-park-jiyoon-class-calculus-1-2026-spring-a-20260407T150000Z",
                         "ses-student-stu-lee-doyun-class-calculus-1-2026-spring-a-20260407T151500Z"
                     ],
    "created_at":  "2026-04-08T11:25:00Z",
    "related_page_id":  "page-faq-homework-submission",
    "updated_at":  "2026-04-08T11:25:00Z"
}
