{
    "candidate_id":  "cand-misconception-class-calculus-1-2026-spring-a-chain-rule-product-rule-mixup-20260408T112000Z",
    "kind":  "misconception",
    "status":  "open",
    "title":  "Chain rule and product rule confusion",
    "summary":  "Multiple students are using the product rule when the expression is a composition.",
    "class_id":  "class-calculus-1-2026-spring-a",
    "course_id":  "course-calculus-1",
    "actor_role":  "system",
    "confidence":  0.82,
    "tags":  [
                 "chain-rule",
                 "product-rule",
                 "misconception"
             ],
    "source_refs":  [
                        {
                            "source_id":  "src-lecture-note-class-calculus-1-2026-spring-a-week-03-20260408T103000Z",
                            "source_type":  "lecture_note",
                            "chunk_id":  "compare-rules"
                        },
                        {
                            "source_id":  "src-lecture-note-class-calculus-1-2026-spring-a-chain-rule-support-20260408T111500Z",
                            "source_type":  "lecture_note",
                            "chunk_id":  "recommended-intervention"
                        }
                    ],
    "session_refs":  [
                         "ses-student-stu-kim-minji-class-calculus-1-2026-spring-a-20260407T133000Z"
                     ],
    "created_at":  "2026-04-08T11:20:00Z",
    "related_page_id":  "page-misconceptions-chain-rule-product-rule",
    "updated_at":  "2026-04-08T11:20:00Z"
}
