{
  "candidate_id": "cand-misconception-class-calculus-1-2026-spring-a-chain-rule-product-rule-mixup-20260408T112000Z",
  "kind": "misconception",
  "status": "open",
  "title": "연쇄법칙과 곱의 미분법 혼동",
  "summary": "A반 학생들이 chain rule과 product rule을 식의 구조보다 계산 절차로만 구분하는 패턴이 반복되고 있습니다.",
  "class_id": "class-calculus-1-2026-spring-a",
  "course_id": "course-calculus-1",
  "actor_role": "system",
  "confidence": 0.84,
  "tags": ["chain-rule", "product-rule", "misconception"],
  "source_refs": [
    {
      "source_id": "src-lecture-note-class-calculus-1-2026-spring-a-week-03-20260408T103000Z",
      "source_type": "lecture_note",
      "chunk_id": "compare-rules"
    },
    {
      "source_id": "src-lecture-note-class-calculus-1-2026-spring-a-chain-rule-support-20260408T111500Z",
      "source_type": "lecture_note",
      "chunk_id": "recommended-intervention"
    }
  ],
  "session_refs": [
    "ses-student-stu-kim-minji-class-calculus-1-2026-spring-a-20260407T133000Z",
    "ses-student-stu-kim-minji-class-calculus-1-2026-spring-a-20260408T091000Z"
  ],
  "created_at": "2026-04-08T11:20:00Z",
  "related_page_id": "page-misconceptions-chain-rule-product-rule",
  "updated_at": "2026-04-08T11:20:00Z"
}
