{
  "candidate_id": "cand-unresolved_question-class-calculus-1-2026-spring-a-substitution-boundaries-20260402T113000Z",
  "kind": "unresolved_question",
  "status": "open",
  "title": "substitution 적용 한계 정리 필요",
  "summary": "적분 단원에서 substitution이 어디까지 유효한지에 대한 공식 wiki 보강이 아직 부족합니다.",
  "class_id": "class-calculus-1-2026-spring-a",
  "course_id": "course-calculus-1",
  "actor_role": "system",
  "confidence": 0.58,
  "tags": ["integrals", "substitution", "unresolved"],
  "source_refs": [
    {
      "source_id": "src-lecture-note-class-calculus-1-2026-spring-a-week-03-20260408T103000Z",
      "source_type": "lecture_note",
      "chunk_id": "scope-gap"
    }
  ],
  "session_refs": [
    "ses-student-stu-kim-minji-class-calculus-1-2026-spring-a-20260408T114000Z"
  ],
  "created_at": "2026-04-02T11:30:00Z",
  "updated_at": "2026-04-02T11:30:00Z"
}
